### ISSUE TITLE
TLS Handshake fails from docker container on gce

### ISSUE THREAD

**Issue by w9n** [linuxkit/linuxkit#2496]
**Description**
Hi there,

this is a really weird problem.

I use  linuxkit with docker, its remote api and normally a nginx container with valid certs. For further debugging i have created a minimalistic example container on `wiin/nginx-test-ssl` listening on port 443 with a self signed certificate and a proxy url to https://google.com and aswell on port 80 as tcp with a proxy url to https://docker.io.

Everything works perfectly fine on qemu and from another gce instance through the private network. But when i try to reach the linuxkit machine through a `publicly attached ip address` from another gce instance or from locally only port 80 works. When curling port 443 a tcp handshake is established, the `Client Hello` SSL handshake packet gets transmitted, but the `Server Hello` never reaches the Client. I have tcpdumped on another container on the server with --net=host and in a client container locally.

I also tested in a new gce project with open firewall ports for tcp on 80 and  443.

Please let me know if you have any idea whats going wrong here. 

**Steps to reproduce the issue:**
<details>
<summary>linuxkit yaml</summary>

```
 kernel:
  image: linuxkit/kernel:4.9.46
  cmdline: "console=tty0 console=ttyS0 console=ttyAMA0"
init:
  - linuxkit/init:6d11a1f9d299d3425e78cce80dfba8b236d20412
  - linuxkit/runc:a1b564248a0d0b118c11e61db9f84ecf41dd2d2a
  - linuxkit/containerd:7d97282aebe36040fcdd3378a95562d440d34a9d
  - linuxkit/ca-certificates:e44b0a66df5a102c0e220f0066b0d904710dcb10
onboot:
  - name: sysctl
    image: linuxkit/sysctl:154913b72c6f1f33eb408609fca9963628e8c051
  - name: sysfs
    image: linuxkit/sysfs:3ae01a25583ee37a5ff8b09a0e569cb4bd8cf2e9
  - name: format
    image: linuxkit/format:158d992b7bf7ab984100c697d7e72161ea7d7382
  - name: mount
    image: linuxkit/mount:4fe245efb01384e42622c36302e13e386bbaeb08
    command: ["/usr/bin/mountie", "/var/lib/docker"]
services:
  - name: getty
    image: linuxkit/getty:797cb79e0a229fcd16ebf44a0da74bcec03968ec
    env:
     - INSECURE=true
  - name: rngd
    image: linuxkit/rngd:558e86a36242bb74353bc9287b715ddb8567357e
  - name: dhcpcd
    image: linuxkit/dhcpcd:f3f5413abb78fae9020e35bd4788fa93df4530b7
  - name: ntpd
    image: linuxkit/openntpd:0d7befc79842849d0b88d6c3b64200e340d7cf67
  - name: docker
    image: docker:17.07.0-ce-dind
    capabilities:
     - all
    net: host
    mounts:
     - type: cgroup
       options: ["rw","nosuid","noexec","nodev","relatime"]
    binds:
     - /etc/resolv.conf:/etc/resolv.conf
     - /var/lib/docker:/var/lib/docker
     - /lib/modules:/lib/modules
     - /etc/docker/daemon.json:/etc/docker/daemon.json
    command: ["/usr/local/bin/docker-init", "/usr/local/bin/dockerd"]
files:
  - path: var/lib/docker
    directory: true
  - path: etc/docker/daemon.json
    contents: '{"debug": true}'
trust:
  org:
    - linuxkit
    - library 
```

</details>

<details>
<summary>Dockerfile of wiin/nginx-ssl-test</summary>

```
FROM nginx:alpine

COPY ./certs/ /etc/nginx/certs/
COPY ./nginx.conf /etc/nginx/conf.d/nginx.conf
CMD nginx-debug -g 'daemon off;' -c /etc/nginx/conf.d/nginx.conf
```

</details>

<details>
<summary>nginx.conf</summary>

```
events {                                                                                       
    worker_connections  1024;                                                                  
}      
http{
    server {
      server_name _;
      listen 80;
      location / {
        proxy_pass https://docker.io;
      }
    }
    server {                                                                                   
      server_name _;                                                  
      listen 443 ssl ;                                                                         
      ssl on;                                                                                
      ssl_certificate /etc/nginx/certs/ca.pem;                         
      ssl_certificate_key /etc/nginx/certs/ca-key.pem;
      ssl_dhparam /etc/nginx/certs/dh.pem;                   
      location / {                                                                             
        proxy_pass https://google.com;                                          
      }                                                                                        
    }
}

```

</details>

**Describe the results you received:**

<details>
<summary>server side tcpdump</summary>

```
01:46:58.189131 IP the-client-ip.49144 > instance_name.c.projectname.internal.443: Flags [S], seq 3703270176, win 29200, options [mss 1460,sackOK,TS val 4288116389 ecr 0,nop,wscale 7], length 0
	0x0000:  4500 003c 7de8 4000 3506 f526 8d17 3af8  E..<}.@.5..&..:.
	0x0010:  0a9c 0002 bff8 01bb dcbb 6b20 0000 0000  ..........k.....
	0x0020:  a002 7210 8375 0000 0204 05b4 0402 080a  ..r..u..........
	0x0030:  ff97 76a5 0000 0000 0103 0307            ..v.........
01:46:58.189172 IP the-client-ip.49144 > 172.17.0.2.443: Flags [S], seq 3703270176, win 29200, options [mss 1460,sackOK,TS val 4288116389 ecr 0,nop,wscale 7], length 0
	0x0000:  4500 003c 7de8 4000 3406 54b1 8d17 3af8  E..<}.@.4.T...:.
	0x0010:  ac11 0002 bff8 01bb dcbb 6b20 0000 0000  ..........k.....
	0x0020:  a002 7210 e1ff 0000 0204 05b4 0402 080a  ..r.............
	0x0030:  ff97 76a5 0000 0000 0103 0307            ..v.........
01:46:58.189179 IP the-client-ip.49144 > 172.17.0.2.443: Flags [S], seq 3703270176, win 29200, options [mss 1460,sackOK,TS val 4288116389 ecr 0,nop,wscale 7], length 0
	0x0000:  4500 003c 7de8 4000 3406 54b1 8d17 3af8  E..<}.@.4.T...:.
	0x0010:  ac11 0002 bff8 01bb dcbb 6b20 0000 0000  ..........k.....
	0x0020:  a002 7210 e1ff 0000 0204 05b4 0402 080a  ..r.............
	0x0030:  ff97 76a5 0000 0000 0103 0307            ..v.........
01:46:58.189233 IP 172.17.0.2.443 > the-client-ip.49144: Flags [S.], seq 3984573027, ack 3703270177, win 28960, options [mss 1460,sackOK,TS val 642785 ecr 4288116389,nop,wscale 7], length 0
	0x0000:  4500 003c 0000 4000 4006 c699 ac11 0002  E..<..@.@.......
	0x0010:  8d17 3af8 01bb bff8 ed7f c263 dcbb 6b21  ..:........c..k!
	0x0020:  a012 7120 7451 0000 0204 05b4 0402 080a  ..q.tQ..........
	0x0030:  0009 cee1 ff97 76a5 0103 0307            ......v.....
01:46:58.189233 IP 172.17.0.2.443 > the-client-ip.49144: Flags [S.], seq 3984573027, ack 3703270177, win 28960, options [mss 1460,sackOK,TS val 642785 ecr 4288116389,nop,wscale 7], length 0
	0x0000:  4500 003c 0000 4000 4006 c699 ac11 0002  E..<..@.@.......
	0x0010:  8d17 3af8 01bb bff8 ed7f c263 dcbb 6b21  ..:........c..k!
	0x0020:  a012 7120 7451 0000 0204 05b4 0402 080a  ..q.tQ..........
	0x0030:  0009 cee1 ff97 76a5 0103 0307            ......v.....
01:46:58.189244 IP instance_name.c.projectname.internal.443 > the-client-ip.49144: Flags [S.], seq 3984573027, ack 3703270177, win 28960, options [mss 1460,sackOK,TS val 642785 ecr 4288116389,nop,wscale 7], length 0
	0x0000:  4500 003c 0000 4000 3f06 690f 0a9c 0002  E..<..@.?.i.....
	0x0010:  8d17 3af8 01bb bff8 ed7f c263 dcbb 6b21  ..:........c..k!
	0x0020:  a012 7120 d2db 0000 0204 05b4 0402 080a  ..q.............
	0x0030:  0009 cee1 ff97 76a5 0103 0307            ......v.....
01:46:58.206808 IP the-client-ip.49144 > instance_name.c.projectname.internal.443: Flags [.], ack 1, win 229, options [nop,nop,TS val 4288116395 ecr 642785], length 0
	0x0000:  4500 0034 7de9 4000 3506 f52d 8d17 3af8  E..4}.@.5..-..:.
	0x0010:  0a9c 0002 bff8 01bb dcbb 6b21 ed7f c264  ..........k!...d
	0x0020:  8010 00e5 a487 0000 0101 080a ff97 76ab  ..............v.
	0x0030:  0009 cee1                                ....
01:46:58.206849 IP the-client-ip.49144 > 172.17.0.2.443: Flags [.], ack 1, win 229, options [nop,nop,TS val 4288116395 ecr 642785], length 0
	0x0000:  4500 0034 7de9 4000 3406 54b8 8d17 3af8  E..4}.@.4.T...:.
	0x0010:  ac11 0002 bff8 01bb dcbb 6b21 ed7f c264  ..........k!...d
	0x0020:  8010 00e5 0312 0000 0101 080a ff97 76ab  ..............v.
	0x0030:  0009 cee1                                ....
01:46:58.206858 IP the-client-ip.49144 > 172.17.0.2.443: Flags [.], ack 1, win 229, options [nop,nop,TS val 4288116395 ecr 642785], length 0
	0x0000:  4500 0034 7de9 4000 3406 54b8 8d17 3af8  E..4}.@.4.T...:.
	0x0010:  ac11 0002 bff8 01bb dcbb 6b21 ed7f c264  ..........k!...d
	0x0020:  8010 00e5 0312 0000 0101 080a ff97 76ab  ..............v.
	0x0030:  0009 cee1                                ....
01:46:58.220712 IP the-client-ip.49144 > instance_name.c.projectname.internal.443: Flags [P.], seq 1:242, ack 1, win 229, options [nop,nop,TS val 4288116399 ecr 642785], length 241
	0x0000:  4500 0125 7dea 4000 3506 f43b 8d17 3af8  E..%}.@.5..;..:.
	0x0010:  0a9c 0002 bff8 01bb dcbb 6b21 ed7f c264  ..........k!...d
	0x0020:  8018 00e5 18e4 0000 0101 080a ff97 76af  ..............v.
	0x0030:  0009 cee1 1603 0100 ec01 0000 e803 0342  ...............B
	0x0040:  25f2 32c2 5111 ecb2 4bec 42be 12a7 e2d5  %.2.Q...K.B.....
	0x0050:  decb d2cf fb4c 3e7f ce95 13eb b1ab 1800  .....L>.........
	0x0060:  0070 c030 c02c c028 c024 c014 c00a 00a3  .p.0.,.(.$......
	0x0070:  009f 006b 006a 0039 0038 cca9 cca8 ccaa  ...k.j.9.8......
	0x0080:  cc14 cc13 cc15 ff85 00c4 00c3 0088 0087  ................
	0x0090:  0081 009d 003d 0035 00c0 0084 c02f c02b  .....=.5...../.+
	0x00a0:  c027 c023 c013 c009 00a2 009e 0067 0040  .'.#.........g.@
	0x00b0:  0033 0032 00be 00bd 0045 0044 009c 003c  .3.2.....E.D...<
	0x00c0:  002f 00ba 0041 c012 c008 0016 0013 000a  ./...A..........
	0x00d0:  00ff 0100 004f 000b 0002 0100 000a 0008  .....O..........
	0x00e0:  0006 001d 0017 0018 000d 0026 0024 0601  ...........&.$..
	0x00f0:  0602 0603 efef 0501 0502 0503 0401 0402  ................
	0x0100:  0403 eeee eded 0301 0302 0303 0201 0202  ................
	0x0110:  0203 3374 0000 0010 000b 0009 0868 7474  ..3t.........htt
	0x0120:  702f 312e 31                             p/1.1
01:46:58.220741 IP the-client-ip.49144 > 172.17.0.2.443: Flags [P.], seq 1:242, ack 1, win 229, options [nop,nop,TS val 4288116399 ecr 642785], length 241
	0x0000:  4500 0125 7dea 4000 3406 53c6 8d17 3af8  E..%}.@.4.S...:.
	0x0010:  ac11 0002 bff8 01bb dcbb 6b21 ed7f c264  ..........k!...d
	0x0020:  8018 00e5 776e 0000 0101 080a ff97 76af  ....wn........v.
	0x0030:  0009 cee1 1603 0100 ec01 0000 e803 0342  ...............B
	0x0040:  25f2 32c2 5111 ecb2 4bec 42be 12a7 e2d5  %.2.Q...K.B.....
	0x0050:  decb d2cf fb4c 3e7f ce95 13eb b1ab 1800  .....L>.........
	0x0060:  0070 c030 c02c c028 c024 c014 c00a 00a3  .p.0.,.(.$......
	0x0070:  009f 006b 006a 0039 0038 cca9 cca8 ccaa  ...k.j.9.8......
	0x0080:  cc14 cc13 cc15 ff85 00c4 00c3 0088 0087  ................
	0x0090:  0081 009d 003d 0035 00c0 0084 c02f c02b  .....=.5...../.+
	0x00a0:  c027 c023 c013 c009 00a2 009e 0067 0040  .'.#.........g.@
	0x00b0:  0033 0032 00be 00bd 0045 0044 009c 003c  .3.2.....E.D...<
	0x00c0:  002f 00ba 0041 c012 c008 0016 0013 000a  ./...A..........
	0x00d0:  00ff 0100 004f 000b 0002 0100 000a 0008  .....O..........
	0x00e0:  0006 001d 0017 0018 000d 0026 0024 0601  ...........&.$..
	0x00f0:  0602 0603 efef 0501 0502 0503 0401 0402  ................
	0x0100:  0403 eeee eded 0301 0302 0303 0201 0202  ................
	0x0110:  0203 3374 0000 0010 000b 0009 0868 7474  ..3t.........htt
	0x0120:  702f 312e 31                             p/1.1
01:46:58.220747 IP the-client-ip.49144 > 172.17.0.2.443: Flags [P.], seq 1:242, ack 1, win 229, options [nop,nop,TS val 4288116399 ecr 642785], length 241
	0x0000:  4500 0125 7dea 4000 3406 53c6 8d17 3af8  E..%}.@.4.S...:.
	0x0010:  ac11 0002 bff8 01bb dcbb 6b21 ed7f c264  ..........k!...d
	0x0020:  8018 00e5 776e 0000 0101 080a ff97 76af  ....wn........v.
	0x0030:  0009 cee1 1603 0100 ec01 0000 e803 0342  ...............B
	0x0040:  25f2 32c2 5111 ecb2 4bec 42be 12a7 e2d5  %.2.Q...K.B.....
	0x0050:  decb d2cf fb4c 3e7f ce95 13eb b1ab 1800  .....L>.........
	0x0060:  0070 c030 c02c c028 c024 c014 c00a 00a3  .p.0.,.(.$......
	0x0070:  009f 006b 006a 0039 0038 cca9 cca8 ccaa  ...k.j.9.8......
	0x0080:  cc14 cc13 cc15 ff85 00c4 00c3 0088 0087  ................
	0x0090:  0081 009d 003d 0035 00c0 0084 c02f c02b  .....=.5...../.+
	0x00a0:  c027 c023 c013 c009 00a2 009e 0067 0040  .'.#.........g.@
	0x00b0:  0033 0032 00be 00bd 0045 0044 009c 003c  .3.2.....E.D...<
	0x00c0:  002f 00ba 0041 c012 c008 0016 0013 000a  ./...A..........
	0x00d0:  00ff 0100 004f 000b 0002 0100 000a 0008  .....O..........
	0x00e0:  0006 001d 0017 0018 000d 0026 0024 0601  ...........&.$..
	0x00f0:  0602 0603 efef 0501 0502 0503 0401 0402  ................
	0x0100:  0403 eeee eded 0301 0302 0303 0201 0202  ................
	0x0110:  0203 3374 0000 0010 000b 0009 0868 7474  ..3t.........htt
	0x0120:  702f 312e 31                             p/1.1
01:46:58.220776 IP 172.17.0.2.443 > the-client-ip.49144: Flags [.], ack 242, win 235, options [nop,nop,TS val 642789 ecr 4288116399], length 0
	0x0000:  4500 0034 0c87 4000 4006 ba1a ac11 0002  E..4..@.@.......
	0x0010:  8d17 3af8 01bb bff8 ed7f c264 dcbb 6c12  ..:........d..l.
	0x0020:  8010 00eb 7449 0000 0101 080a 0009 cee5  ....tI..........
	0x0030:  ff97 76af                                ..v.
01:46:58.220776 IP 172.17.0.2.443 > the-client-ip.49144: Flags [.], ack 242, win 235, options [nop,nop,TS val 642789 ecr 4288116399], length 0
	0x0000:  4500 0034 0c87 4000 4006 ba1a ac11 0002  E..4..@.@.......
	0x0010:  8d17 3af8 01bb bff8 ed7f c264 dcbb 6c12  ..:........d..l.
	0x0020:  8010 00eb 7449 0000 0101 080a 0009 cee5  ....tI..........
	0x0030:  ff97 76af                                ..v.
01:46:58.220787 IP instance_name.c.projectname.internal.443 > the-client-ip.49144: Flags [.], ack 242, win 235, options [nop,nop,TS val 642789 ecr 4288116399], length 0
	0x0000:  4500 0034 0c87 4000 3f06 5c90 0a9c 0002  E..4..@.?.\.....
	0x0010:  8d17 3af8 01bb bff8 ed7f c264 dcbb 6c12  ..:........d..l.
	0x0020:  8010 00eb d2d3 0000 0101 080a 0009 cee5  ................
	0x0030:  ff97 76af                                ..v.
01:46:58.221799 IP 172.17.0.2.443 > the-client-ip.49144: Flags [P.], seq 1:1442, ack 242, win 235, options [nop,nop,TS val 642789 ecr 4288116399], length 1441
	0x0000:  4500 05d5 0c88 4000 4006 b478 ac11 0002  E.....@.@..x....
	0x0010:  8d17 3af8 01bb bff8 ed7f c264 dcbb 6c12  ..:........d..l.
	0x0020:  8018 00eb 79ea 0000 0101 080a 0009 cee5  ....y...........
	0x0030:  ff97 76af 1603 0300 6802 0000 6403 038d  ..v.....h...d...
	0x0040:  ad66 9651 35f9 16e0 2142 5f35 585c 344e  .f.Q5...!B_5X\4N
	0x0050:  cf13 c17f 57af 7c03 193a e075 d67b c020  ....W.|..:.u.{..
	0x0060:  7a54 3628 baa8 8dd2 688c c41f 81a8 4224  zT6(....h.....B$
	0x0070:  4812 d48b 01a3 5e5e 5391 7f45 5b62 ce78  H.....^^S..E[b.x
	0x0080:  c030 0000 1cff 0100 0100 000b 0004 0300  .0..............
	0x0090:  0102 0010 000b 0009 0868 7474 702f 312e  .........http/1.
	0x00a0:  3116 0303 03d4 0b00 03d0 0003 cd00 03ca  1...............
	0x00b0:  3082 03c6 3082 02ae a003 0201 0202 1468  0...0..........h
	0x00c0:  8ff6 131f 25e1 9914 6b5d 1b01 3f66 03d1  ....%...k]..?f..
	0x00d0:  8484 a830 0d06 092a 8648 86f7 0d01 010b  ...0...*.H......
	0x00e0:  0500 3069 310b 3009 0603 5504 0613 0255  ..0i1.0...U....U
	0x00f0:  5331 1330 1106 0355 0408 130a 4361 6c69  S1.0...U....Cali
	0x0100:  666f 726e 6961 3116 3014 0603 5504 0713  fornia1.0...U...
	0x0110:  0d53 616e 2046 7261 6e63 6973 636f 311f  .San.Francisco1.
	0x0120:  301d 0603 5504 0a13 1649 6e74 6572 6e65  0...U....Interne
	0x0130:  7420 5769 6467 6574 732c 2049 6e63 2e31  t.Widgets,.Inc.1
	0x0140:  0c30 0a06 0355 040b 1303 5757 5730 1e17  .0...U....WWW0..
	0x0150:  0d31 3730 3930 3930 3233 3030 305a 170d  .170909023000Z..
	0x0160:  3232 3039 3038 3032 3330 3030 5a30 6931  220908023000Z0i1
	0x0170:  0b30 0906 0355 0406 1302 5553 3113 3011  .0...U....US1.0.
	0x0180:  0603 5504 0813 0a43 616c 6966 6f72 6e69  ..U....Californi
	0x0190:  6131 1630 1406 0355 0407 130d 5361 6e20  a1.0...U....San.
	0x01a0:  4672 616e 6369 7363 6f31 1f30 1d06 0355  Francisco1.0...U
	0x01b0:  040a 1316 496e 7465 726e 6574 2057 6964  ....Internet.Wid
	0x01c0:  6765 7473 2c20 496e 632e 310c 300a 0603  gets,.Inc.1.0...
	0x01d0:  5504 0b13 0357 5757 3082 0122 300d 0609  U....WWW0.."0...
	0x01e0:  2a86 4886 f70d 0101 0105 0003 8201 0f00  *.H.............
	0x01f0:  3082 010a 0282 0101 00c4 8c7b 7b1d 696b  0..........{{.ik
	0x0200:  c70c b3db a128 476b deb6 ff0e c01c 0ec6  .....(Gk........
	0x0210:  08b4 25a6 cef9 dd2e c5f2 a8e2 a313 eab7  ..%.............
	0x0220:  8355 ee90 4b55 6df4 1c0f cc14 ce22 f20a  .U..KUm......"..
	0x0230:  d8db 6e0b fae0 f053 4af9 d547 bcb8 4a7d  ..n....SJ..G..J}
	0x0240:  1252 5609 696a 4574 83f4 6b2d fbd6 b635  .RV.ijEt..k-...5
	0x0250:  6fa2 c43d 25e3 a9a5 4e28 8987 8275 fe29  o..=%...N(...u.)
	0x0260:  4ee1 ac56 d8c7 a00a fca9 8094 765d 7633  N..V........v]v3
	0x0270:  ec6d 3b94 9c97 e890 c5b7 195f 003b 611f  .m;........_.;a.
	0x0280:  6274 7b73 f79c b17a 5516 6c42 7f07 5a75  bt{s...zU.lB..Zu
	0x0290:  e59e 3ebe ce16 04bc bf9d 0003 9829 4bc9  ..>..........)K.
	0x02a0:  757d 5cd8 3213 2fa3 111a 6046 a169 b29c  u}\.2./...`F.i..
	0x02b0:  2c4e e552 05db f59c 1258 ff33 7882 2bf5  ,N.R.....X.3x.+.
	0x02c0:  e479 f780 1fac 6141 abed c4ed d9d8 2381  .y....aA......#.
	0x02d0:  2f3e 9fbe c89f ed75 d927 0ce4 e061 fc01  />.....u.'...a..
	0x02e0:  8a3a 399a a2a0 d8b2 4352 697b eff5 dc2b  .:9.....CRi{...+
	0x02f0:  80f1 c531 ac1a 1725 4d02 0301 0001 a366  ...1...%M......f
	0x0300:  3064 300e 0603 551d 0f01 01ff 0404 0302  0d0...U.........
	0x0310:  0106 3012 0603 551d 1301 01ff 0408 3006  ..0...U.......0.
	0x0320:  0101 ff02 0102 301d 0603 551d 0e04 1604  ......0...U.....
	0x0330:  145a 80dd 6328 f436 c557 fc58 6ac2 8072  .Z..c(.6.W.Xj..r
	0x0340:  8177 84ba 9930 1f06 0355 1d23 0418 3016  .w...0...U.#..0.
	0x0350:  8014 5a80 dd63 28f4 36c5 57fc 586a c280  ..Z..c(.6.W.Xj..
	0x0360:  7281 7784 ba99 300d 0609 2a86 4886 f70d  r.w...0...*.H...
	0x0370:  0101 0b05 0003 8201 0100 7194 d955 af3a  ..........q..U.:
	0x0380:  e833 6ba7 a71a 134e d088 b39f da80 f694  .3k....N........
	0x0390:  b62e f7b7 5b1a 5da3 0fbb b423 e266 f6c0  ....[.]....#.f..
	0x03a0:  8a95 aad8 6e3b 97a6 f351 1a2a 39c1 e0b6  ....n;...Q.*9...
	0x03b0:  c13f 957b a323 f0fe 1c3e e631 e6ea fea6  .?.{.#...>.1....
	0x03c0:  7f50 c4a0 c91b 4a38 a9c8 3325 2e03 2cf8  .P....J8..3%..,.
	0x03d0:  a995 a4f6 16ea 1fa0 535a b223 bbc1 8f10  ........SZ.#....
	0x03e0:  1e13 dc54 7ae5 4c0a 642e fab2 2088 4856  ...Tz.L.d.....HV
	0x03f0:  511f 136e 3287 6f60 6acf ff42 656e 3a0c  Q..n2.o`j..Ben:.
	0x0400:  f14c 396e 6858 39ee 52fd 80d2 ce65 80e2  .L9nhX9.R....e..
	0x0410:  663d b38d 9870 b931 2a3a 1bef 514a 6db2  f=...p.1*:..QJm.
	0x0420:  c75e 9624 c887 4e08 ff5b 1506 dfa3 1508  .^.$..N..[......
	0x0430:  d466 26e5 8aae b1d1 a204 e706 3f75 1af6  .f&.........?u..
	0x0440:  6765 fa18 1e8c 981b f05f e40e 1769 d856  ge......._...i.V
	0x0450:  5161 e59a c09c f5b3 6871 46eb c26c bda0  Qa......hqF..l..
	0x0460:  98a1 793c f248 d216 6abf 00e7 254f 7088  ..y<.H..j...%Op.
	0x0470:  96a9 d757 9484 d3f0 ba98 1603 0301 4d0c  ...W..........M.
	0x0480:  0001 4903 0017 4104 66e4 b616 91d4 b63a  ..I...A.f......:
	0x0490:  854c 0fc6 fcf9 7f9d 3f02 756d 80b8 aef6  .L......?.um....
	0x04a0:  2f69 25d7 b607 7903 3886 ca66 786c 98e7  /i%...y.8..fxl..
	0x04b0:  807b 3ca0 21cd 8354 e558 023a 0ebe 6427  .{<.!..T.X.:..d'
	0x04c0:  bc82 389b 8976 ab95 0601 0100 5709 6d0e  ..8..v......W.m.
	0x04d0:  3248 707a 1fdc 269c cbea 4945 086f ac1f  2Hpz..&...IE.o..
	0x04e0:  2b62 be79 b658 1be7 6b35 edf8 1ae5 75ce  +b.y.X..k5....u.
	0x04f0:  f542 3cfd 7a22 0609 60c1 8d32 1919 8d41  .B<.z"..`..2...A
	0x0500:  8c17 2c71 c985 cd1d e0a2 9a6c f23c 9e04  ..,q.......l.<..
	0x0510:  fc85 a647 6ee8 0fa4 b8a0 ec2d d855 d9e8  ...Gn......-.U..
	0x0520:  a729 ccf9 245b 7006 3cf2 982a 2542 bcba  .)..$[p.<..*%B..
	0x0530:  22cd 6ba7 6acc aaeb be18 9f27 1999 ce19  ".k.j......'....
	0x0540:  8151 6668 3156 311e e0a7 26e3 3d15 947d  .Qfh1V1...&.=..}
	0x0550:  d103 2fed 25c8 5958 47de ed59 c91d bf7d  ../.%.YXG..Y...}
	0x0560:  3f1d c556 ddf0 71e4 004e 8914 0def c8d2  ?..V..q..N......
	0x0570:  f9e7 94b4 01e5 61f7 4d26 5c4a 3a80 0d02  ......a.M&\J:...
	0x0580:  b58c 7df4 6a8d ee69 46a9 e3a1 9115 50a1  ..}.j..iF.....P.
	0x0590:  464c 0504 5698 120d dc3b 428c 8957 3905  FL..V....;B..W9.
	0x05a0:  596c a2a4 9ac8 d3f0 9cf5 f7f2 45c0 999e  Yl..........E...
	0x05b0:  2a64 5248 441c a0fa f688 3821 34b8 c17a  *dRHD.....8!4..z
	0x05c0:  37c0 b6b7 0c35 5299 07df 1e7a 1603 0300  7....5R....z....
	0x05d0:  040e 0000 00                             .....
01:46:58.221799 IP 172.17.0.2.443 > the-client-ip.49144: Flags [P.], seq 1:1442, ack 242, win 235, options [nop,nop,TS val 642789 ecr 4288116399], length 1441
	0x0000:  4500 05d5 0c88 4000 4006 b478 ac11 0002  E.....@.@..x....
	0x0010:  8d17 3af8 01bb bff8 ed7f c264 dcbb 6c12  ..:........d..l.
	0x0020:  8018 00eb 79ea 0000 0101 080a 0009 cee5  ....y...........
	0x0030:  ff97 76af 1603 0300 6802 0000 6403 038d  ..v.....h...d...
	0x0040:  ad66 9651 35f9 16e0 2142 5f35 585c 344e  .f.Q5...!B_5X\4N
	0x0050:  cf13 c17f 57af 7c03 193a e075 d67b c020  ....W.|..:.u.{..
	0x0060:  7a54 3628 baa8 8dd2 688c c41f 81a8 4224  zT6(....h.....B$
	0x0070:  4812 d48b 01a3 5e5e 5391 7f45 5b62 ce78  H.....^^S..E[b.x
	0x0080:  c030 0000 1cff 0100 0100 000b 0004 0300  .0..............
	0x0090:  0102 0010 000b 0009 0868 7474 702f 312e  .........http/1.
	0x00a0:  3116 0303 03d4 0b00 03d0 0003 cd00 03ca  1...............
	0x00b0:  3082 03c6 3082 02ae a003 0201 0202 1468  0...0..........h
	0x00c0:  8ff6 131f 25e1 9914 6b5d 1b01 3f66 03d1  ....%...k]..?f..
	0x00d0:  8484 a830 0d06 092a 8648 86f7 0d01 010b  ...0...*.H......
	0x00e0:  0500 3069 310b 3009 0603 5504 0613 0255  ..0i1.0...U....U
	0x00f0:  5331 1330 1106 0355 0408 130a 4361 6c69  S1.0...U....Cali
	0x0100:  666f 726e 6961 3116 3014 0603 5504 0713  fornia1.0...U...
	0x0110:  0d53 616e 2046 7261 6e63 6973 636f 311f  .San.Francisco1.
	0x0120:  301d 0603 5504 0a13 1649 6e74 6572 6e65  0...U....Interne
	0x0130:  7420 5769 6467 6574 732c 2049 6e63 2e31  t.Widgets,.Inc.1
	0x0140:  0c30 0a06 0355 040b 1303 5757 5730 1e17  .0...U....WWW0..
	0x0150:  0d31 3730 3930 3930 3233 3030 305a 170d  .170909023000Z..
	0x0160:  3232 3039 3038 3032 3330 3030 5a30 6931  220908023000Z0i1
	0x0170:  0b30 0906 0355 0406 1302 5553 3113 3011  .0...U....US1.0.
	0x0180:  0603 5504 0813 0a43 616c 6966 6f72 6e69  ..U....Californi
	0x0190:  6131 1630 1406 0355 0407 130d 5361 6e20  a1.0...U....San.
	0x01a0:  4672 616e 6369 7363 6f31 1f30 1d06 0355  Francisco1.0...U
	0x01b0:  040a 1316 496e 7465 726e 6574 2057 6964  ....Internet.Wid
	0x01c0:  6765 7473 2c20 496e 632e 310c 300a 0603  gets,.Inc.1.0...
	0x01d0:  5504 0b13 0357 5757 3082 0122 300d 0609  U....WWW0.."0...
	0x01e0:  2a86 4886 f70d 0101 0105 0003 8201 0f00  *.H.............
	0x01f0:  3082 010a 0282 0101 00c4 8c7b 7b1d 696b  0..........{{.ik
	0x0200:  c70c b3db a128 476b deb6 ff0e c01c 0ec6  .....(Gk........
	0x0210:  08b4 25a6 cef9 dd2e c5f2 a8e2 a313 eab7  ..%.............
	0x0220:  8355 ee90 4b55 6df4 1c0f cc14 ce22 f20a  .U..KUm......"..
	0x0230:  d8db 6e0b fae0 f053 4af9 d547 bcb8 4a7d  ..n....SJ..G..J}
	0x0240:  1252 5609 696a 4574 83f4 6b2d fbd6 b635  .RV.ijEt..k-...5
	0x0250:  6fa2 c43d 25e3 a9a5 4e28 8987 8275 fe29  o..=%...N(...u.)
	0x0260:  4ee1 ac56 d8c7 a00a fca9 8094 765d 7633  N..V........v]v3
	0x0270:  ec6d 3b94 9c97 e890 c5b7 195f 003b 611f  .m;........_.;a.
	0x0280:  6274 7b73 f79c b17a 5516 6c42 7f07 5a75  bt{s...zU.lB..Zu
	0x0290:  e59e 3ebe ce16 04bc bf9d 0003 9829 4bc9  ..>..........)K.
	0x02a0:  757d 5cd8 3213 2fa3 111a 6046 a169 b29c  u}\.2./...`F.i..
	0x02b0:  2c4e e552 05db f59c 1258 ff33 7882 2bf5  ,N.R.....X.3x.+.
	0x02c0:  e479 f780 1fac 6141 abed c4ed d9d8 2381  .y....aA......#.
	0x02d0:  2f3e 9fbe c89f ed75 d927 0ce4 e061 fc01  />.....u.'...a..
	0x02e0:  8a3a 399a a2a0 d8b2 4352 697b eff5 dc2b  .:9.....CRi{...+
	0x02f0:  80f1 c531 ac1a 1725 4d02 0301 0001 a366  ...1...%M......f
	0x0300:  3064 300e 0603 551d 0f01 01ff 0404 0302  0d0...U.........
	0x0310:  0106 3012 0603 551d 1301 01ff 0408 3006  ..0...U.......0.
	0x0320:  0101 ff02 0102 301d 0603 551d 0e04 1604  ......0...U.....
	0x0330:  145a 80dd 6328 f436 c557 fc58 6ac2 8072  .Z..c(.6.W.Xj..r
	0x0340:  8177 84ba 9930 1f06 0355 1d23 0418 3016  .w...0...U.#..0.
	0x0350:  8014 5a80 dd63 28f4 36c5 57fc 586a c280  ..Z..c(.6.W.Xj..
	0x0360:  7281 7784 ba99 300d 0609 2a86 4886 f70d  r.w...0...*.H...
	0x0370:  0101 0b05 0003 8201 0100 7194 d955 af3a  ..........q..U.:
	0x0380:  e833 6ba7 a71a 134e d088 b39f da80 f694  .3k....N........
	0x0390:  b62e f7b7 5b1a 5da3 0fbb b423 e266 f6c0  ....[.]....#.f..
	0x03a0:  8a95 aad8 6e3b 97a6 f351 1a2a 39c1 e0b6  ....n;...Q.*9...
	0x03b0:  c13f 957b a323 f0fe 1c3e e631 e6ea fea6  .?.{.#...>.1....
	0x03c0:  7f50 c4a0 c91b 4a38 a9c8 3325 2e03 2cf8  .P....J8..3%..,.
	0x03d0:  a995 a4f6 16ea 1fa0 535a b223 bbc1 8f10  ........SZ.#....
	0x03e0:  1e13 dc54 7ae5 4c0a 642e fab2 2088 4856  ...Tz.L.d.....HV
	0x03f0:  511f 136e 3287 6f60 6acf ff42 656e 3a0c  Q..n2.o`j..Ben:.
	0x0400:  f14c 396e 6858 39ee 52fd 80d2 ce65 80e2  .L9nhX9.R....e..
	0x0410:  663d b38d 9870 b931 2a3a 1bef 514a 6db2  f=...p.1*:..QJm.
	0x0420:  c75e 9624 c887 4e08 ff5b 1506 dfa3 1508  .^.$..N..[......
	0x0430:  d466 26e5 8aae b1d1 a204 e706 3f75 1af6  .f&.........?u..
	0x0440:  6765 fa18 1e8c 981b f05f e40e 1769 d856  ge......._...i.V
	0x0450:  5161 e59a c09c f5b3 6871 46eb c26c bda0  Qa......hqF..l..
	0x0460:  98a1 793c f248 d216 6abf 00e7 254f 7088  ..y<.H..j...%Op.
	0x0470:  96a9 d757 9484 d3f0 ba98 1603 0301 4d0c  ...W..........M.
	0x0480:  0001 4903 0017 4104 66e4 b616 91d4 b63a  ..I...A.f......:
	0x0490:  854c 0fc6 fcf9 7f9d 3f02 756d 80b8 aef6  .L......?.um....
	0x04a0:  2f69 25d7 b607 7903 3886 ca66 786c 98e7  /i%...y.8..fxl..
	0x04b0:  807b 3ca0 21cd 8354 e558 023a 0ebe 6427  .{<.!..T.X.:..d'
	0x04c0:  bc82 389b 8976 ab95 0601 0100 5709 6d0e  ..8..v......W.m.
	0x04d0:  3248 707a 1fdc 269c cbea 4945 086f ac1f  2Hpz..&...IE.o..
	0x04e0:  2b62 be79 b658 1be7 6b35 edf8 1ae5 75ce  +b.y.X..k5....u.
	0x04f0:  f542 3cfd 7a22 0609 60c1 8d32 1919 8d41  .B<.z"..`..2...A
	0x0500:  8c17 2c71 c985 cd1d e0a2 9a6c f23c 9e04  ..,q.......l.<..
	0x0510:  fc85 a647 6ee8 0fa4 b8a0 ec2d d855 d9e8  ...Gn......-.U..
	0x0520:  a729 ccf9 245b 7006 3cf2 982a 2542 bcba  .)..$[p.<..*%B..
	0x0530:  22cd 6ba7 6acc aaeb be18 9f27 1999 ce19  ".k.j......'....
	0x0540:  8151 6668 3156 311e e0a7 26e3 3d15 947d  .Qfh1V1...&.=..}
	0x0550:  d103 2fed 25c8 5958 47de ed59 c91d bf7d  ../.%.YXG..Y...}
	0x0560:  3f1d c556 ddf0 71e4 004e 8914 0def c8d2  ?..V..q..N......
	0x0570:  f9e7 94b4 01e5 61f7 4d26 5c4a 3a80 0d02  ......a.M&\J:...
	0x0580:  b58c 7df4 6a8d ee69 46a9 e3a1 9115 50a1  ..}.j..iF.....P.
	0x0590:  464c 0504 5698 120d dc3b 428c 8957 3905  FL..V....;B..W9.
	0x05a0:  596c a2a4 9ac8 d3f0 9cf5 f7f2 45c0 999e  Yl..........E...
	0x05b0:  2a64 5248 441c a0fa f688 3821 34b8 c17a  *dRHD.....8!4..z
	0x05c0:  37c0 b6b7 0c35 5299 07df 1e7a 1603 0300  7....5R....z....
	0x05d0:  040e 0000 00                             .....

```

</details>

<details>
<summary>client side tcpdump</summary>

```
01:46:42.556040 IP 862f13823872.49144 > the-server-ip.bc.googleusercontent.com.443: Flags [S], seq 3703270176, win 29200, options [mss 1460,sackOK,TS val 4288116389 ecr 0,nop,wscale 7], length 0
	0x0000:  4500 003c 7de8 4000 4006 a8e3 ac11 0002  E..<}.@.@.......
	0x0010:  23c6 4417 bff8 01bb dcbb 6b20 0000 0000  #.D.......k.....
	0x0020:  a002 7210 141f 0000 0204 05b4 0402 080a  ..r.............
	0x0030:  ff97 76a5 0000 0000 0103 0307            ..v.........
01:46:42.573730 IP the-server-ip.bc.googleusercontent.com.443 > 862f13823872.49144: Flags [S.], seq 3984573027, ack 3703270177, win 28960, options [mss 1460,sackOK,TS val 642785 ecr 4288116389,nop,wscale 7], length 0
	0x0000:  4500 003c 0000 4000 3d06 29cc 23c6 4417  E..<..@.=.).#.D.
	0x0010:  ac11 0002 01bb bff8 ed7f c263 dcbb 6b21  ...........c..k!
	0x0020:  a012 7120 c442 0000 0204 05b4 0402 080a  ..q..B..........
	0x0030:  0009 cee1 ff97 76a5 0103 0307            ......v.....
01:46:42.573760 IP 862f13823872.49144 > the-server-ip.bc.googleusercontent.com.443: Flags [.], ack 1, win 229, options [nop,nop,TS val 4288116395 ecr 642785], length 0
	0x0000:  4500 0034 7de9 4000 4006 a8ea ac11 0002  E..4}.@.@.......
	0x0010:  23c6 4417 bff8 01bb dcbb 6b21 ed7f c264  #.D.......k!...d
	0x0020:  8010 00e5 1417 0000 0101 080a ff97 76ab  ..............v.
	0x0030:  0009 cee1                                ....
01:46:42.587697 IP 862f13823872.49144 > the-server-ip.bc.googleusercontent.com.443: Flags [P.], seq 1:242, ack 1, win 229, options [nop,nop,TS val 4288116399 ecr 642785], length 241
	0x0000:  4500 0125 7dea 4000 4006 a7f8 ac11 0002  E..%}.@.@.......
	0x0010:  23c6 4417 bff8 01bb dcbb 6b21 ed7f c264  #.D.......k!...d
	0x0020:  8018 00e5 1508 0000 0101 080a ff97 76af  ..............v.
	0x0030:  0009 cee1 1603 0100 ec01 0000 e803 0342  ...............B
	0x0040:  25f2 32c2 5111 ecb2 4bec 42be 12a7 e2d5  %.2.Q...K.B.....
	0x0050:  decb d2cf fb4c 3e7f ce95 13eb b1ab 1800  .....L>.........
	0x0060:  0070 c030 c02c c028 c024 c014 c00a 00a3  .p.0.,.(.$......
	0x0070:  009f 006b 006a 0039 0038 cca9 cca8 ccaa  ...k.j.9.8......
	0x0080:  cc14 cc13 cc15 ff85 00c4 00c3 0088 0087  ................
	0x0090:  0081 009d 003d 0035 00c0 0084 c02f c02b  .....=.5...../.+
	0x00a0:  c027 c023 c013 c009 00a2 009e 0067 0040  .'.#.........g.@
	0x00b0:  0033 0032 00be 00bd 0045 0044 009c 003c  .3.2.....E.D...<
	0x00c0:  002f 00ba 0041 c012 c008 0016 0013 000a  ./...A..........
	0x00d0:  00ff 0100 004f 000b 0002 0100 000a 0008  .....O..........
	0x00e0:  0006 001d 0017 0018 000d 0026 0024 0601  ...........&.$..
	0x00f0:  0602 0603 efef 0501 0502 0503 0401 0402  ................
	0x0100:  0403 eeee eded 0301 0302 0303 0201 0202  ................
	0x0110:  0203 3374 0000 0010 000b 0009 0868 7474  ..3t.........htt
	0x0120:  702f 312e 31                             p/1.1
01:46:42.605185 IP the-server-ip.bc.googleusercontent.com.443 > 862f13823872.49144: Flags [.], ack 242, win 235, options [nop,nop,TS val 642789 ecr 4288116399], length 0
	0x0000:  4500 0034 0c87 4000 3d06 1d4d 23c6 4417  E..4..@.=..M#.D.
	0x0010:  ac11 0002 01bb bff8 ed7f c264 dcbb 6c12  ...........d..l.
	0x0020:  8010 00eb 6245 0000 0101 080a 0009 cee5  ....bE..........
	0x0030:  ff97 76af                                ..v.

```

</details>

**Describe the results you expected:**

A valid ssl handshake and a redirect to https://google.com

**Additional information you deem important (e.g. issue happens only occasionally):**

I also tested a linuxkit version with directly embedding the nginx container as a service on gce and it worked as expected.

**Comment by justincormack** [comment]
Google Cloud has smaller MTU support than other clouds. I thought we had
resolved this in the dhcp support, but it could possibly be the issue. Does
it behave correctly if you lower the MTU of eth0?

**Comment by w9n** [comment]
thanks! this should have been obvious from the length of an Server Hello. A MTU of 1460 solves the problem. Funny note if I switch back to 1500 it still works... 

this should be automated by the option interface_mtu in [dhcpcd.conf](https://github.com/linuxkit/linuxkit/blob/master/pkg/dhcpcd/dhcpcd.conf#L29) which is present and should have been used.  Will try to find some time to dig into this but cant promise anything soon.

**Comment by justincormack** [comment]
I will take a look; this is based on what we used for Docker for GCP, which seems to work. This is slightly non standard - most configs now use per route MTU, but that didnt seem to work well always.

**Comment by asbjornenge** [comment]
FYI: I'm seeing the exact same issue on GCP!! Exact same setup work perfectly on aws. Replaced linuxkit gateway with ubuntu on gcp side and suddenly everything works 🤷‍♂️ 👍

**Comment by justincormack** [comment]
@asbjornenge can you check the MTU set on `eth0`? Also check you are using dhcpcd with https://github.com/linuxkit/linuxkit/pull/3078 included

**Comment by asbjornenge** [comment]
@justincormack sorry, it was a couple of iterations ago, and the gateway node has now been replaced with ubuntu. I'm in the process of updating my `linuxkit` images to 0.6, I'll give it another try then and report back if I still see it 👍

**Comment by asbjornenge** [comment]
@justincormack 

GCP eth0 MTU: 1460
AWS eth0 MTU: 1500

Using `dhcpcd:v0.6` (other layers @ v0.6 too) and kernel `4.9.76` (unable to properly boot more updated kernel).

**Comment by justincormack** [comment]
Ok, so the MTU is set correctly; you didnt say if you are still seeing the issue though...

**Comment by asbjornenge** [comment]
@justincormack I didn't replace the gateway node yet, so didn't get a chance to test SSL. However; Thanks for pointing me in the MTU direction, seems MTU if 2800 for my SDN layer 😳 that might be my issue!! 😛🙈 I'll report back when fixed...
